{
  "schemaVersion": "1.0.0",
  "solutionId": "btn-bb-srp-qh7s2c-node0",
  "game": {
    "type": "NLHE",
    "playerCount": 6,
    "blinds": {
      "small": 10,
      "big": 20
    },
    "ante": 0,
    "effectiveStack": 2000,
    "chipUnit": "chips"
  },
  "spot": {
    "positions": {
      "inPosition": "BTN",
      "outOfPosition": "BB"
    },
    "pot": 110,
    "street": "flop",
    "board": [
      "Qh",
      "7s",
      "2c"
    ],
    "actionHistory": [
      {
        "street": "preflop",
        "actor": "UTG",
        "actionId": "fold",
        "kind": "fold"
      },
      {
        "street": "preflop",
        "actor": "HJ",
        "actionId": "fold",
        "kind": "fold"
      },
      {
        "street": "preflop",
        "actor": "CO",
        "actionId": "fold",
        "kind": "fold"
      },
      {
        "street": "preflop",
        "actor": "BTN",
        "actionId": "raise-to-50",
        "kind": "raise",
        "amount": 50
      },
      {
        "street": "preflop",
        "actor": "SB",
        "actionId": "fold",
        "kind": "fold"
      },
      {
        "street": "preflop",
        "actor": "BB",
        "actionId": "call-30",
        "kind": "call",
        "amount": 30
      }
    ],
    "playerToAct": "BB"
  },
  "heroCombo": "QcQd",
  "actions": [
    {
      "id": "check",
      "kind": "check"
    },
    {
      "id": "bet-36.4",
      "kind": "bet",
      "amount": 36.4,
      "potFraction": 0.33
    }
  ],
  "strategy": [
    {
      "actionId": "check",
      "frequency": 0.705661,
      "ev": 54.86
    },
    {
      "actionId": "bet-36.4",
      "frequency": 0.294339,
      "ev": 55
    }
  ],
  "bestEv": 55,
  "provenance": {
    "solver": "ucsandman/postflop",
    "solverVersion": "0.1.0",
    "sourceRevision": null,
    "rawFormatVersion": 1,
    "generatedAt": "2026-09-28T11:23:18.495Z",
    "configSha256": "fb8c59006a4abba7831e8583034d8dba3f5a2c30d5280126be4594fe91424be3",
    "rawArtifactSha256": "a4df7001ba42e3fc8396bfc146a3b0125bebdd879666a743ba0eed5231cece83",
    "execution": {
      "kind": "official-hosted-wasm-workbench",
      "url": "https://postflop-workbench.vercel.app/"
    },
    "actionEv": {
      "source": "Official Inspector combo rows; title attributes report action EV to 0.001bb, converted at 20 chips/bb",
      "precision": 0.02
    },
    "solve": {
      "iterations": 50,
      "exploitabilityChips": 0.0409,
      "exploitabilityPctOfPot": 0.0372
    }
  }
}
